incident_id,service_id,incident_date,severity,category,start_time,end_time,downtime_minutes,resolution_notes,status
INC-1490,SRV-005,2025-06-15,P3,Application,2025-06-15 13:25:37,2025-06-15 14:23:37,58,Great plant son natural hear blood.,Resolved
INC-1446,SRV-007,2025-06-17,P2,Database,2025-06-17 15:20:03,2025-06-17 17:04:03,104,Yourself whom style no order executive range.,Resolved
INC-1377,SRV-008,2025-06-18,P4,Database,2025-06-18 14:05:41,2025-06-18 14:39:41,34,Customer nor fight performance less option.,Resolved
INC-1334,SRV-005,2025-06-18,P4,Application,2025-06-18 17:25:26,2025-06-18 18:02:26,37,Carry spring white measure manager range indeed.,Resolved
INC-1014,SRV-006,2025-06-19,P4,Application,2025-06-19 07:13:39,2025-06-19 07:49:39,36,Race Mr environment political.,Resolved
INC-1367,SRV-003,2025-06-19,P1,Application,2025-06-19 14:15:45,2025-06-19 17:31:45,196,Reduce clearly well mission.,Resolved
INC-1076,SRV-001,2025-06-19,P3,Application,2025-06-19 14:19:35,2025-06-19 14:55:35,36,State black whether player stock religious.,Resolved
INC-1361,SRV-005,2025-06-19,P4,Application,2025-06-19 20:59:21,2025-06-19 21:45:21,46,Value car team nothing half raise.,Resolved
INC-1461,SRV-008,2025-06-20,P3,Application,2025-06-20 14:28:29,2025-06-20 15:16:29,48,Series most adult above safe difficult.,Resolved
INC-1163,SRV-005,2025-06-22,P3,Application,2025-06-22 10:04:01,2025-06-22 11:42:01,98,Tv television office of remember individual boy.,Resolved
INC-1099,SRV-007,2025-06-23,P3,Application,2025-06-23 13:24:41,2025-06-23 13:44:41,20,Office several compare million kind.,Resolved
INC-1164,SRV-007,2025-06-23,P4,Database,2025-06-23 17:05:49,2025-06-23 17:50:49,45,Commercial way least ready gun join.,Resolved
INC-1270,SRV-003,2025-06-23,P4,Infrastructure,2025-06-23 19:58:30,2025-06-23 20:33:30,35,Leg rest interest here discover.,Resolved
INC-1098,SRV-004,2025-06-25,P3,Application,2025-06-25 14:16:41,2025-06-25 15:09:41,53,Director purpose team onto.,Resolved
INC-1048,SRV-005,2025-06-25,P3,Application,2025-06-25 15:16:20,2025-06-25 17:02:20,106,Theory end oil worker.,Resolved
INC-1328,SRV-004,2025-06-26,P3,Application,2025-06-26 16:02:30,2025-06-26 16:48:30,46,Third last involve above Democrat everything region somebody.,Resolved
INC-1303,SRV-006,2025-06-26,P3,Application,2025-06-26 16:44:52,2025-06-26 17:09:52,25,Situation late direction need heart.,Resolved
INC-1156,SRV-008,2025-06-26,P3,Database,2025-06-26 21:53:41,2025-06-26 23:00:41,67,Second Democrat information game.,Resolved
INC-1049,SRV-002,2025-06-29,P3,Network,2025-06-29 06:00:58,2025-06-29 06:37:58,37,Others generation skill job.,Resolved
INC-1471,SRV-002,2025-06-30,P3,Infrastructure,2025-06-30 04:51:16,2025-06-30 05:41:16,50,Many debate value former able public trade.,Resolved
INC-1205,SRV-005,2025-07-01,P4,Application,2025-07-01 10:58:43,2025-07-01 11:04:43,6,Past itself police social arm provide.,Resolved
INC-1160,SRV-008,2025-07-02,P4,Database,2025-07-02 10:41:13,2025-07-02 10:54:13,13,House out account feeling deep.,Resolved
INC-1231,SRV-001,2025-07-02,P2,Application,2025-07-02 14:22:22,2025-07-02 16:49:22,147,Anything no guy eye hit late.,Resolved
INC-1376,SRV-002,2025-07-02,P3,Infrastructure,2025-07-02 17:54:07,2025-07-02 19:35:07,101,Attention let executive suddenly force network.,Resolved
INC-1372,SRV-006,2025-07-02,P3,Application,2025-07-02 19:29:46,2025-07-02 20:49:46,80,Each line him.,Resolved
INC-1266,SRV-003,2025-07-02,P4,Database,2025-07-02 20:28:53,2025-07-02 20:38:53,10,General as yes various attorney value.,Resolved
INC-1290,SRV-007,2025-07-03,P3,Application,2025-07-03 13:19:12,2025-07-03 14:25:12,66,Include successful discuss.,Resolved
INC-1229,SRV-001,2025-07-03,P3,Application,2025-07-03 16:18:36,2025-07-03 17:23:36,65,Example our successful.,Resolved
INC-1151,SRV-008,2025-07-04,P4,Database,2025-07-04 15:53:43,2025-07-04 16:39:43,46,Outside goal official defense prevent.,Resolved
INC-1420,SRV-004,2025-07-04,P3,Database,2025-07-04 22:25:09,2025-07-04 23:03:09,38,Occur style child guess into far.,Resolved
INC-1116,SRV-007,2025-07-06,P2,Application,2025-07-06 13:05:08,2025-07-06 16:49:08,224,Grow issue each include radio.,Resolved
INC-1360,SRV-001,2025-07-06,P4,Network,2025-07-06 16:55:16,2025-07-06 17:36:16,41,Manager both matter order month.,Resolved
INC-1171,SRV-008,2025-07-07,P3,Application,2025-07-07 10:29:13,2025-07-07 10:40:13,11,Story baby ten talk past medical.,Resolved
INC-1458,SRV-003,2025-07-07,P3,Application,2025-07-07 11:43:33,2025-07-07 11:56:33,13,Later decide similar.,Resolved
INC-1137,SRV-005,2025-07-08,P3,Application,2025-07-08 12:38:03,2025-07-08 13:47:03,69,Every why we station begin deep.,Resolved
INC-1224,SRV-003,2025-07-08,P2,Infrastructure,2025-07-08 12:56:47,2025-07-08 13:38:47,42,Keep machine daughter parent.,Resolved
INC-1150,SRV-001,2025-07-08,P2,Application,2025-07-08 15:45:47,2025-07-08 16:38:47,53,What no prove improve them wait institution trouble.,Resolved
INC-1347,SRV-008,2025-07-09,P2,Application,2025-07-09 08:45:05,2025-07-09 10:44:05,119,Huge why station manager follow exist natural.,Resolved
INC-1192,SRV-007,2025-07-09,P3,Application,2025-07-09 14:29:18,2025-07-09 16:12:18,103,Student matter movie place.,Resolved
INC-1258,SRV-003,2025-07-09,P3,Application,2025-07-09 15:38:26,2025-07-09 17:16:26,98,Let civil rather type.,Resolved
INC-1391,SRV-001,2025-07-10,P4,Network,2025-07-10 15:48:22,2025-07-10 16:11:22,23,Total kitchen can toward stop.,Resolved
INC-1325,SRV-006,2025-07-11,P2,Network,2025-07-11 09:15:36,2025-07-11 10:57:36,102,And represent against gas body.,Resolved
INC-1170,SRV-004,2025-07-11,P3,Application,2025-07-11 10:24:26,2025-07-11 11:48:26,84,Kind field ever argue medical financial later.,Resolved
INC-1047,SRV-005,2025-07-11,P3,Application,2025-07-11 18:36:53,2025-07-11 20:17:53,101,Go meeting quickly such former.,Resolved
INC-1281,SRV-008,2025-07-13,P3,Application,2025-07-13 16:43:56,2025-07-13 18:36:56,113,Source onto provide describe decade.,Resolved
INC-1034,SRV-007,2025-07-13,P2,Application,2025-07-13 17:12:21,2025-07-13 19:27:21,135,Defense enter value thing these hard citizen.,Resolved
INC-1145,SRV-002,2025-07-13,P1,Application,2025-07-13 17:35:59,2025-07-13 19:34:59,119,Focus chance call person.,Resolved
INC-1428,SRV-007,2025-07-15,P3,Infrastructure,2025-07-15 18:15:51,2025-07-15 19:34:51,79,Dark state challenge organization floor road.,Resolved
INC-1063,SRV-006,2025-07-16,P1,Application,2025-07-16 09:26:17,2025-07-16 13:56:17,270,Character him check degree.,Resolved
INC-1032,SRV-008,2025-07-16,P3,Application,2025-07-16 13:15:26,2025-07-16 13:41:26,26,Price north first end prove fire.,Resolved
INC-1113,SRV-008,2025-07-16,P2,Application,2025-07-16 23:28:34,2025-07-17 02:49:34,201,System teacher here first responsibility service.,Resolved
INC-1019,SRV-001,2025-07-18,P3,Infrastructure,2025-07-18 08:29:52,2025-07-18 08:53:52,24,Staff within mouth call process water close.,Resolved
INC-1357,SRV-004,2025-07-18,P2,Application,2025-07-18 12:49:27,2025-07-18 16:24:27,215,Cause but role goal.,Resolved
INC-1366,SRV-003,2025-07-18,P3,Database,2025-07-18 14:25:41,2025-07-18 15:36:41,71,Break partner area program price compare.,Resolved
INC-1323,SRV-008,2025-07-18,P4,Database,2025-07-18 22:12:29,2025-07-18 22:46:29,34,Story role give gas.,Resolved
INC-1352,SRV-002,2025-07-20,P3,Application,2025-07-20 17:44:16,2025-07-20 19:09:16,85,Ability live car difficult.,Resolved
INC-1389,SRV-001,2025-07-21,P2,Application,2025-07-21 11:04:12,2025-07-21 14:26:12,202,Big soldier building article sit develop cup.,Resolved
INC-1148,SRV-005,2025-07-21,P2,Application,2025-07-21 16:48:51,2025-07-21 18:31:51,103,Interview professor hear check type attack.,Resolved
INC-1296,SRV-002,2025-07-21,P3,Application,2025-07-21 17:23:16,2025-07-21 18:40:16,77,Here need argue act commercial matter.,Resolved
INC-1082,SRV-008,2025-07-21,P3,Application,2025-07-21 19:45:12,2025-07-21 20:13:12,28,Develop reality fill ok list.,Resolved
INC-1302,SRV-005,2025-07-22,P3,Database,2025-07-22 16:34:51,2025-07-22 18:15:51,101,Discussion away painting pass other why.,Resolved
INC-1115,SRV-005,2025-07-23,P3,Application,2025-07-23 15:16:23,2025-07-23 16:32:23,76,Kitchen really tough animal.,Resolved
INC-1329,SRV-005,2025-07-24,P3,Database,2025-07-24 16:32:52,2025-07-24 18:01:52,89,Cost for leader energy television month police.,Resolved
INC-1307,SRV-006,2025-07-25,P2,Application,2025-07-25 11:36:35,2025-07-25 14:01:35,145,Bed never others.,Resolved
INC-1311,SRV-004,2025-07-26,P2,Application,2025-07-26 18:54:17,2025-07-26 21:45:17,171,Fight we forward per.,Resolved
INC-1413,SRV-001,2025-07-26,P3,Application,2025-07-26 19:52:19,2025-07-26 21:49:19,117,Answer just information.,Resolved
INC-1025,SRV-004,2025-07-27,P4,Network,2025-07-27 14:53:40,2025-07-27 15:34:40,41,Court movie cell contain leg.,Resolved
INC-1018,SRV-007,2025-07-28,P2,Application,2025-07-28 10:40:57,2025-07-28 12:48:57,128,These story film around there water.,Resolved
INC-1015,SRV-003,2025-07-28,P3,Application,2025-07-28 11:58:29,2025-07-28 12:39:29,41,Itself law west then enjoy.,Resolved
INC-1480,SRV-002,2025-07-28,P4,Application,2025-07-28 13:49:12,2025-07-28 14:11:12,22,Key as pressure actually than modern.,Resolved
INC-1133,SRV-001,2025-07-30,P3,Application,2025-07-30 15:38:54,2025-07-30 17:18:54,100,Animal also you break.,Resolved
INC-1084,SRV-001,2025-07-31,P3,Application,2025-07-31 10:44:39,2025-07-31 12:42:39,118,Firm sea week real course.,Resolved
INC-1211,SRV-007,2025-08-01,P3,Infrastructure,2025-08-01 18:52:49,2025-08-01 19:42:49,50,Table later together knowledge.,Resolved
INC-1220,SRV-003,2025-08-02,P1,Infrastructure,2025-08-02 23:17:18,2025-08-03 03:10:18,233,Field move maybe collection walk child probably result.,Resolved
INC-1041,SRV-008,2025-08-03,P4,Application,2025-08-03 14:16:42,2025-08-03 15:05:42,49,Final together someone.,Resolved
INC-1053,SRV-002,2025-08-03,P3,Infrastructure,2025-08-03 16:08:29,2025-08-03 16:37:29,29,Inside wait quality total past.,Resolved
INC-1348,SRV-005,2025-08-04,P4,Application,2025-08-04 11:59:35,2025-08-04 12:40:35,41,System small thus several animal phone student.,Resolved
INC-1465,SRV-007,2025-08-04,P3,Application,2025-08-04 13:11:35,2025-08-04 14:55:35,104,Safe operation college hand practice.,Resolved
INC-1260,SRV-005,2025-08-05,P4,Infrastructure,2025-08-05 10:15:04,2025-08-05 11:10:04,55,Check security paper indeed near likely Mr.,Resolved
INC-1269,SRV-006,2025-08-05,P4,Infrastructure,2025-08-05 14:20:17,2025-08-05 14:33:17,13,Budget year hotel camera without strong.,Resolved
INC-1438,SRV-006,2025-08-06,P3,Database,2025-08-06 07:05:52,2025-08-06 07:16:52,11,These ahead cover strategy student economic lead.,Resolved
INC-1214,SRV-006,2025-08-07,P3,Infrastructure,2025-08-07 12:08:34,2025-08-07 13:10:34,62,So ago network hard sound.,Resolved
INC-1246,SRV-008,2025-08-07,P3,Application,2025-08-07 12:12:36,2025-08-07 12:29:36,17,Past only drug prove.,Resolved
INC-1332,SRV-002,2025-08-07,P1,Application,2025-08-07 14:02:58,2025-08-07 19:04:58,302,Himself control player really population yourself never.,Resolved
INC-1161,SRV-002,2025-08-07,P3,Database,2025-08-07 17:37:15,2025-08-07 18:43:15,66,Face build market issue can.,Resolved
INC-1274,SRV-001,2025-08-08,P4,Application,2025-08-08 10:53:29,2025-08-08 11:34:29,41,Year doctor trouble office officer significant stand.,Resolved
INC-1381,SRV-008,2025-08-09,P4,Network,2025-08-09 11:04:01,2025-08-09 11:35:01,31,Behavior TV today mind red.,Resolved
INC-1344,SRV-006,2025-08-09,P4,Application,2025-08-09 12:29:08,2025-08-09 13:17:08,48,Plan physical heart away some shoulder idea.,Resolved
INC-1263,SRV-003,2025-08-12,P3,Database,2025-08-12 09:33:31,2025-08-12 11:25:31,112,Foreign minute break day.,Resolved
INC-1181,SRV-007,2025-08-13,P3,Application,2025-08-13 10:58:23,2025-08-13 11:24:23,26,Congress realize person total.,Resolved
INC-1305,SRV-003,2025-08-13,P4,Application,2025-08-13 14:29:36,2025-08-13 14:39:36,10,Republican plant science first blood accept.,Resolved
INC-1385,SRV-004,2025-08-14,P3,Database,2025-08-14 14:08:52,2025-08-14 15:54:52,106,Clearly letter image movie.,Resolved
INC-1135,SRV-004,2025-08-14,P3,Application,2025-08-14 20:37:28,2025-08-14 21:56:28,79,Pressure street past voice evidence real.,Resolved
INC-1061,SRV-007,2025-08-15,P2,Database,2025-08-15 13:42:33,2025-08-15 17:23:33,221,Late seem style everyone sing machine dream.,Resolved
INC-1119,SRV-007,2025-08-15,P3,Database,2025-08-15 17:35:22,2025-08-15 18:55:22,80,Kid generation onto police.,Resolved
INC-1478,SRV-001,2025-08-15,P2,Infrastructure,2025-08-15 23:10:22,2025-08-16 00:36:22,86,Indeed opportunity soon question.,Resolved
INC-1008,SRV-002,2025-08-17,P3,Network,2025-08-17 12:23:17,2025-08-17 13:02:17,39,Here writer policy news range successful simply.,Resolved
INC-1073,SRV-006,2025-08-17,P3,Infrastructure,2025-08-17 20:58:28,2025-08-17 21:23:28,25,Blue agent find quality when.,Resolved
INC-1414,SRV-001,2025-08-18,P3,Application,2025-08-18 15:04:11,2025-08-18 16:12:11,68,Manage her national big look tell.,Resolved
INC-1027,SRV-003,2025-08-18,P3,Application,2025-08-18 15:08:54,2025-08-18 16:35:54,87,Magazine degree husband around her world.,Resolved
INC-1341,SRV-004,2025-08-19,P3,Application,2025-08-19 14:09:26,2025-08-19 15:58:26,109,Without fall of weight method too.,Resolved
INC-1288,SRV-007,2025-08-19,P2,Network,2025-08-19 15:51:04,2025-08-19 18:55:04,184,College result major true my politics.,Resolved
INC-1166,SRV-004,2025-08-19,P3,Infrastructure,2025-08-19 17:58:37,2025-08-19 19:03:37,65,Member box member town.,Resolved
INC-1117,SRV-008,2025-08-20,P3,Application,2025-08-20 09:30:44,2025-08-20 09:42:44,12,Bad that people drive.,Resolved
INC-1475,SRV-008,2025-08-20,P3,Application,2025-08-20 13:11:22,2025-08-20 15:11:22,120,Group just perform there behavior spring.,Resolved
INC-1237,SRV-006,2025-08-20,P2,Application,2025-08-20 14:32:15,2025-08-20 18:31:15,239,Pick people subject challenge quite all way.,Resolved
INC-1400,SRV-005,2025-08-21,P2,Application,2025-08-21 07:53:48,2025-08-21 10:57:48,184,Door fish scene grow.,Resolved
INC-1044,SRV-003,2025-08-22,P3,Network,2025-08-22 08:30:51,2025-08-22 09:45:51,75,Agent say forward us soon ten.,Resolved
INC-1059,SRV-003,2025-08-22,P2,Network,2025-08-22 17:35:57,2025-08-22 19:38:57,123,Let newspaper true building card let most.,Resolved
INC-1373,SRV-004,2025-08-23,P3,Infrastructure,2025-08-23 17:48:12,2025-08-23 19:25:12,97,Need trial scientist.,Resolved
INC-1476,SRV-004,2025-08-25,P3,Database,2025-08-25 16:00:59,2025-08-25 17:21:59,81,Husband while even history.,Resolved
INC-1194,SRV-008,2025-08-26,P2,Database,2025-08-26 14:23:31,2025-08-26 16:25:31,122,Model guess well name.,Resolved
INC-1492,SRV-008,2025-08-26,P4,Database,2025-08-26 14:59:52,2025-08-26 15:24:52,25,Us hotel lead sit.,Resolved
INC-1252,SRV-007,2025-08-26,P3,Network,2025-08-26 22:58:00,2025-08-27 00:38:00,100,Theory across nothing blue work.,Resolved
INC-1419,SRV-006,2025-08-27,P3,Application,2025-08-27 14:33:53,2025-08-27 15:33:53,60,Recent reveal role enter example down.,Resolved
INC-1238,SRV-003,2025-08-28,P2,Application,2025-08-28 11:09:19,2025-08-28 12:23:19,74,Kid industry include.,Resolved
INC-1242,SRV-005,2025-08-28,P3,Application,2025-08-28 16:40:54,2025-08-28 17:35:54,55,Everything fear walk word side.,Resolved
INC-1255,SRV-003,2025-08-29,P3,Database,2025-08-29 12:01:37,2025-08-29 12:54:37,53,Particularly police if into.,Resolved
INC-1239,SRV-002,2025-09-02,P4,Application,2025-09-02 17:48:29,2025-09-02 18:42:29,54,Maybe particularly likely summer road relationship.,Resolved
INC-1243,SRV-001,2025-09-03,P3,Network,2025-09-03 17:19:08,2025-09-03 19:15:08,116,First give value somebody event business quality.,Resolved
INC-1029,SRV-008,2025-09-07,P3,Network,2025-09-07 12:41:09,2025-09-07 13:19:09,38,Often my security arm.,Resolved
INC-1451,SRV-005,2025-09-09,P3,Application,2025-09-09 17:43:30,2025-09-09 19:17:30,94,Point little wait grow feel color price.,Resolved
INC-1295,SRV-001,2025-09-10,P3,Application,2025-09-10 11:23:31,2025-09-10 12:59:31,96,Range summer president teach service.,Resolved
INC-1415,SRV-008,2025-09-10,P3,Infrastructure,2025-09-10 11:39:00,2025-09-10 11:51:00,12,Later son almost after.,Resolved
INC-1153,SRV-004,2025-09-10,P4,Application,2025-09-10 14:30:19,2025-09-10 14:44:19,14,Suddenly window stand party poor ago.,Resolved
INC-1354,SRV-002,2025-09-11,P3,Infrastructure,2025-09-11 13:21:22,2025-09-11 13:48:22,27,Become south billion happen federal him.,Resolved
INC-1009,SRV-002,2025-09-11,P4,Application,2025-09-11 16:05:57,2025-09-11 16:39:57,34,Source husband at.,Resolved
INC-1473,SRV-007,2025-09-12,P2,Application,2025-09-12 19:38:12,2025-09-12 22:12:12,154,Write fast less between company always fact.,Resolved
INC-1379,SRV-003,2025-09-13,P1,Network,2025-09-13 10:46:46,2025-09-13 13:37:46,171,Get style theory week ability price support.,Resolved
INC-1056,SRV-007,2025-09-14,P1,Application,2025-09-14 10:02:02,2025-09-14 13:16:02,194,Different current agency each little.,Resolved
INC-1257,SRV-001,2025-09-14,P3,Infrastructure,2025-09-14 11:06:01,2025-09-14 12:54:01,108,Send west few reveal activity president realize.,Resolved
INC-1167,SRV-002,2025-09-14,P3,Application,2025-09-14 21:48:07,2025-09-14 23:26:07,98,Chair culture own set.,Resolved
INC-1275,SRV-001,2025-09-15,P3,Application,2025-09-15 15:09:20,2025-09-15 15:49:20,40,Then worry miss including every.,Resolved
INC-1193,SRV-008,2025-09-16,P3,Application,2025-09-16 09:26:36,2025-09-16 10:11:36,45,Fact ability good number.,Resolved
INC-1484,SRV-006,2025-09-16,P2,Database,2025-09-16 10:15:28,2025-09-16 13:21:28,186,Wife anyone development poor idea dog.,Resolved
INC-1081,SRV-002,2025-09-16,P3,Application,2025-09-16 15:30:05,2025-09-16 17:00:05,90,Major serve real position make society.,Resolved
INC-1079,SRV-002,2025-09-17,P3,Database,2025-09-17 06:40:19,2025-09-17 08:26:19,106,Now property from management foot maintain great.,Resolved
INC-1309,SRV-002,2025-09-17,P4,Application,2025-09-17 13:58:27,2025-09-17 14:22:27,24,Minute rate college especially environmental certainly cold.,Resolved
INC-1165,SRV-001,2025-09-17,P3,Application,2025-09-17 15:48:26,2025-09-17 16:28:26,40,Open model how financial fund four.,Resolved
INC-1011,SRV-003,2025-09-18,P3,Application,2025-09-18 12:43:05,2025-09-18 13:24:05,41,Much section investment on gun young catch.,Resolved
INC-1045,SRV-002,2025-09-19,P2,Infrastructure,2025-09-19 11:11:10,2025-09-19 12:41:10,90,City red him although likely.,Resolved
INC-1071,SRV-005,2025-09-19,P3,Network,2025-09-19 20:57:50,2025-09-19 22:02:50,65,Stuff perform draw list boy.,Resolved
INC-1468,SRV-004,2025-09-21,P3,Application,2025-09-21 11:11:29,2025-09-21 11:54:29,43,Reduce day rate act inside big minute.,Resolved
INC-1294,SRV-001,2025-09-21,P4,Network,2025-09-21 15:43:29,2025-09-21 16:03:29,20,Environment however health image north wrong.,Resolved
INC-1080,SRV-004,2025-09-23,P2,Network,2025-09-23 13:19:08,2025-09-23 14:00:08,41,Evidence other they new might course.,Resolved
INC-1286,SRV-007,2025-09-24,P3,Infrastructure,2025-09-24 13:51:27,2025-09-24 14:50:27,59,Various often individual charge form here street.,Resolved
INC-1388,SRV-007,2025-09-24,P4,Application,2025-09-24 17:02:48,2025-09-24 17:08:48,6,All identify laugh security.,Resolved
INC-1416,SRV-001,2025-09-24,P3,Application,2025-09-24 20:35:11,2025-09-24 21:20:11,45,Avoid color heart rule.,Resolved
INC-1028,SRV-004,2025-09-25,P4,Infrastructure,2025-09-25 11:13:17,2025-09-25 11:43:17,30,Expect recent room situation product main couple.,Resolved
INC-1370,SRV-005,2025-09-25,P4,Infrastructure,2025-09-25 14:59:06,2025-09-25 15:44:06,45,Physical many member area teacher cold church.,Resolved
INC-1222,SRV-004,2025-09-25,P2,Application,2025-09-25 16:01:18,2025-09-25 18:27:18,146,Short indicate police marriage phone.,Resolved
INC-1033,SRV-008,2025-09-26,P3,Application,2025-09-26 09:56:24,2025-09-26 11:06:24,70,Capital population lead upon very act.,Resolved
INC-1104,SRV-005,2025-09-26,P4,Network,2025-09-26 13:49:40,2025-09-26 13:55:40,6,Capital explain thing machine ahead picture son.,Resolved
INC-1337,SRV-001,2025-09-27,P3,Application,2025-09-27 12:55:20,2025-09-27 13:38:20,43,Statement happen state among rest national wrong.,Resolved
INC-1424,SRV-001,2025-09-27,P3,Application,2025-09-27 16:57:45,2025-09-27 18:35:45,98,Article sell property beat gas must wife.,Resolved
INC-1158,SRV-007,2025-09-28,P2,Application,2025-09-28 09:44:56,2025-09-28 13:32:56,228,Product magazine kind event sense box.,Resolved
INC-1336,SRV-007,2025-09-29,P2,Application,2025-09-29 10:43:53,2025-09-29 14:36:53,233,Mrs collection leader score she.,Resolved
INC-1439,SRV-004,2025-09-29,P4,Application,2025-09-29 13:24:19,2025-09-29 13:39:19,15,Statement measure play buy air head.,Resolved
INC-1201,SRV-001,2025-09-29,P2,Network,2025-09-29 16:51:48,2025-09-29 18:52:48,121,Son join hundred keep.,Resolved
INC-1085,SRV-006,2025-09-30,P4,Database,2025-09-30 11:08:47,2025-09-30 11:41:47,33,With modern executive beyond create dinner conference add.,Resolved
INC-1343,SRV-008,2025-09-30,P4,Application,2025-09-30 11:20:33,2025-09-30 11:45:33,25,Reduce car chair focus.,Resolved
INC-1310,SRV-004,2025-09-30,P4,Application,2025-09-30 13:20:03,2025-09-30 13:58:03,38,Feel site guess want result many.,Resolved
INC-1140,SRV-001,2025-09-30,P4,Database,2025-09-30 14:14:19,2025-09-30 15:02:19,48,Would music sometimes body.,Resolved
INC-1107,SRV-002,2025-09-30,P3,Infrastructure,2025-09-30 14:43:44,2025-09-30 16:05:44,82,Future skin environment able rise study.,Resolved
INC-1003,SRV-008,2025-09-30,P3,Application,2025-09-30 20:34:55,2025-09-30 22:27:55,113,Democratic shake bill here.,Resolved
INC-1100,SRV-006,2025-10-01,P3,Application,2025-10-01 08:47:25,2025-10-01 09:05:25,18,Young job sport why.,Resolved
INC-1267,SRV-006,2025-10-04,P4,Database,2025-10-04 08:14:45,2025-10-04 08:45:45,31,Conference career political role white hear.,Resolved
INC-1463,SRV-004,2025-10-05,P4,Application,2025-10-05 14:59:41,2025-10-05 15:39:41,40,Road others full thousand yet garden top.,Resolved
INC-1199,SRV-004,2025-10-06,P4,Application,2025-10-06 09:13:58,2025-10-06 09:27:58,14,Analysis current among value middle.,Resolved
INC-1126,SRV-001,2025-10-07,P2,Application,2025-10-07 10:21:43,2025-10-07 12:53:43,152,Section compare car much will most.,Resolved
INC-1452,SRV-002,2025-10-07,P4,Application,2025-10-07 10:27:57,2025-10-07 11:10:57,43,Likely scientist rise next.,Resolved
INC-1497,SRV-008,2025-10-07,P2,Network,2025-10-07 13:02:46,2025-10-07 14:12:46,70,Source catch owner though mention successful natural.,Resolved
INC-1300,SRV-008,2025-10-09,P4,Application,2025-10-09 10:08:46,2025-10-09 10:58:46,50,Nor note support quality.,Resolved
INC-1054,SRV-006,2025-10-09,P2,Application,2025-10-09 18:38:22,2025-10-09 21:50:22,192,Nature a expert involve oil pressure.,Resolved
INC-1089,SRV-005,2025-10-10,P3,Application,2025-10-10 16:45:08,2025-10-10 18:04:08,79,Yes budget share paper.,Resolved
INC-1331,SRV-003,2025-10-11,P4,Application,2025-10-11 10:35:52,2025-10-11 11:12:52,37,Consumer really memory industry.,Resolved
INC-1265,SRV-002,2025-10-12,P4,Application,2025-10-12 09:45:54,2025-10-12 10:38:54,53,How staff second.,Resolved
INC-1454,SRV-002,2025-10-12,P4,Network,2025-10-12 11:44:31,2025-10-12 12:04:31,20,Small former end family surface like.,Resolved
INC-1498,SRV-007,2025-10-14,P4,Application,2025-10-14 10:00:38,2025-10-14 10:49:38,49,Plan cut person fact generation public wonder.,Resolved
INC-1225,SRV-007,2025-10-14,P3,Application,2025-10-14 18:17:48,2025-10-14 19:23:48,66,Safe team wish candidate have no.,Resolved
INC-1110,SRV-003,2025-10-16,P3,Application,2025-10-16 06:53:05,2025-10-16 08:36:05,103,Relate specific history professional star wonder manager.,Resolved
INC-1226,SRV-002,2025-10-16,P4,Application,2025-10-16 14:13:32,2025-10-16 14:25:32,12,Letter environment easy best face.,Resolved
INC-1397,SRV-003,2025-10-17,P2,Database,2025-10-17 19:54:13,2025-10-17 20:38:13,44,Establish ago others ahead specific exactly.,Resolved
INC-1436,SRV-005,2025-10-17,P3,Network,2025-10-17 20:19:34,2025-10-17 20:40:34,21,Rock painting become kid tree.,Resolved
INC-1146,SRV-001,2025-10-19,P4,Infrastructure,2025-10-19 09:25:52,2025-10-19 10:04:52,39,Yes most law painting between reduce.,Resolved
INC-1069,SRV-005,2025-10-19,P2,Network,2025-10-19 11:16:25,2025-10-19 14:18:25,182,Seven here sell story edge bank.,Resolved
INC-1392,SRV-006,2025-10-21,P3,Application,2025-10-21 08:58:08,2025-10-21 10:46:08,108,Amount leave collection off.,Resolved
INC-1301,SRV-006,2025-10-21,P4,Infrastructure,2025-10-21 11:05:46,2025-10-21 11:55:46,50,Sense cause write right may window.,Resolved
INC-1175,SRV-005,2025-10-22,P3,Network,2025-10-22 17:36:28,2025-10-22 19:32:28,116,Form newspaper hit edge.,Resolved
INC-1322,SRV-003,2025-10-26,P2,Database,2025-10-26 10:26:44,2025-10-26 13:23:44,177,Lot far turn.,Resolved
INC-1411,SRV-006,2025-10-27,P2,Application,2025-10-27 09:29:16,2025-10-27 13:03:16,214,Collection those become remember police though.,Resolved
INC-1245,SRV-001,2025-10-27,P3,Application,2025-10-27 12:37:30,2025-10-27 14:30:30,113,Pretty section degree still even no.,Resolved
INC-1188,SRV-004,2025-10-28,P2,Application,2025-10-28 10:23:08,2025-10-28 13:31:08,188,Increase how hear.,Resolved
INC-1101,SRV-001,2025-10-28,P1,Application,2025-10-28 12:41:55,2025-10-28 13:51:55,70,Four prove tax form really explain.,Resolved
INC-1340,SRV-002,2025-10-29,P4,Application,2025-10-29 10:36:58,2025-10-29 11:09:58,33,Plan coach cause deal deal arrive go exactly.,Resolved
INC-1004,SRV-007,2025-11-01,P4,Application,2025-11-01 13:48:49,2025-11-01 14:02:49,14,Page southern role movie win her.,Resolved
