incident_id,service_id,incident_date,severity,category,start_time,end_time,downtime_minutes,resolution_notes,status
INC-1233,SRV-001,2025-11-03,P2,Database,2025-11-03 11:18:54,2025-11-03 12:31:54,73,Current meeting matter and.,Resolved
INC-1209,SRV-007,2025-11-04,P3,Network,2025-11-04 23:29:17,2025-11-05 01:08:17,99,Fire everything whether ago control military.,Resolved
INC-1157,SRV-007,2025-11-05,P3,Application,2025-11-05 15:22:41,2025-11-05 16:13:41,51,Return since nothing be apply.,Resolved
INC-1382,SRV-007,2025-11-06,P4,Application,2025-11-06 05:08:36,2025-11-06 05:37:36,29,Window be believe card star avoid nothing.,Resolved
INC-1375,SRV-004,2025-11-06,P2,Application,2025-11-06 10:36:26,2025-11-06 11:44:26,68,Maybe top conference source.,Resolved
INC-1186,SRV-001,2025-11-06,P4,Application,2025-11-06 15:05:51,2025-11-06 15:17:51,12,Various represent middle by base civil last.,Resolved
INC-1351,SRV-004,2025-11-06,P3,Database,2025-11-06 19:47:06,2025-11-06 20:31:06,44,Appear personal rise sense.,Resolved
INC-1434,SRV-002,2025-11-06,P3,Application,2025-11-06 20:15:56,2025-11-06 21:13:56,58,Full soldier financial.,Resolved
INC-1406,SRV-008,2025-11-07,P4,Infrastructure,2025-11-07 09:51:06,2025-11-07 10:16:06,25,Only from follow wish run join.,Resolved
INC-1466,SRV-007,2025-11-07,P3,Application,2025-11-07 16:12:48,2025-11-07 17:52:48,100,Side perhaps order answer blue.,Resolved
INC-1445,SRV-006,2025-11-08,P2,Application,2025-11-08 16:38:19,2025-11-08 20:05:19,207,Learn design few minute perhaps once.,Resolved
INC-1304,SRV-008,2025-11-09,P2,Network,2025-11-09 13:50:04,2025-11-09 16:41:04,171,Sign far east available.,Resolved
INC-1121,SRV-003,2025-11-10,P2,Application,2025-11-10 10:20:22,2025-11-10 13:59:22,219,Grow fast recognize against stop how account.,Resolved
INC-1208,SRV-006,2025-11-10,P3,Application,2025-11-10 16:17:41,2025-11-10 17:43:41,86,Allow check last he know baby case.,Resolved
INC-1227,SRV-005,2025-11-11,P3,Network,2025-11-11 09:43:09,2025-11-11 10:43:09,60,Industry while total spend value return couple city.,Resolved
INC-1058,SRV-003,2025-11-11,P3,Application,2025-11-11 15:56:19,2025-11-11 17:52:19,116,Hundred challenge reach throughout team those sing.,Resolved
INC-1330,SRV-002,2025-11-12,P2,Application,2025-11-12 13:07:49,2025-11-12 17:00:49,233,Hotel box goal leader common purpose song try.,Resolved
INC-1202,SRV-001,2025-11-12,P3,Application,2025-11-12 18:15:25,2025-11-12 18:31:25,16,Wind many marriage under mind song.,Resolved
INC-1365,SRV-007,2025-11-13,P3,Database,2025-11-13 12:11:53,2025-11-13 13:26:53,75,Plant strong race at recognize role suffer around.,Resolved
INC-1426,SRV-003,2025-11-15,P3,Database,2025-11-15 10:36:36,2025-11-15 11:26:36,50,Maybe too song.,Resolved
INC-1390,SRV-001,2025-11-17,P2,Application,2025-11-17 10:03:35,2025-11-17 11:32:35,89,Rather visit base only true avoid.,Resolved
INC-1102,SRV-002,2025-11-17,P2,Application,2025-11-17 12:15:07,2025-11-17 13:40:07,85,Already because education break significant ten stay.,Resolved
INC-1206,SRV-007,2025-11-19,P4,Infrastructure,2025-11-19 16:30:13,2025-11-19 17:06:13,36,Message seek civil all support question.,Resolved
INC-1437,SRV-007,2025-11-20,P3,Network,2025-11-20 08:28:10,2025-11-20 08:49:10,21,Service test start middle city find medical.,Resolved
INC-1093,SRV-003,2025-11-20,P1,Infrastructure,2025-11-20 12:30:35,2025-11-20 17:04:35,274,Ready like allow explain executive teacher author.,Resolved
INC-1112,SRV-004,2025-11-21,P3,Database,2025-11-21 14:17:39,2025-11-21 14:38:39,21,Avoid sit enter perhaps.,Resolved
INC-1064,SRV-004,2025-11-23,P3,Application,2025-11-23 17:55:56,2025-11-23 19:45:56,110,Former letter artist strategy hope show.,Resolved
INC-1450,SRV-002,2025-11-24,P4,Database,2025-11-24 13:18:53,2025-11-24 14:13:53,55,Home along remain occur couple risk.,Resolved
INC-1374,SRV-008,2025-11-24,P4,Application,2025-11-24 22:55:18,2025-11-24 23:23:18,28,Focus indicate result even back.,Resolved
INC-1120,SRV-005,2025-11-26,P3,Application,2025-11-26 17:44:45,2025-11-26 18:09:45,25,Lead few yourself table blood.,Resolved
INC-1159,SRV-007,2025-11-28,P3,Application,2025-11-28 16:20:07,2025-11-28 17:54:07,94,Exist question main project.,Resolved
INC-1091,SRV-007,2025-11-28,P3,Network,2025-11-28 17:21:01,2025-11-28 19:17:01,116,Notice art whether between several.,Resolved
INC-1418,SRV-002,2025-11-29,P2,Application,2025-11-29 18:11:29,2025-11-29 19:42:29,91,Parent its approach former.,Resolved
INC-1182,SRV-005,2025-12-01,P4,Database,2025-12-01 09:56:42,2025-12-01 10:17:42,21,Improve put down.,Resolved
INC-1077,SRV-006,2025-12-01,P3,Application,2025-12-01 12:37:03,2025-12-01 13:43:03,66,Safe whole establish space.,Resolved
INC-1062,SRV-003,2025-12-02,P2,Database,2025-12-02 09:59:35,2025-12-02 13:56:35,237,Require doctor from throw.,Resolved
INC-1339,SRV-007,2025-12-02,P3,Network,2025-12-02 11:33:41,2025-12-02 13:10:41,97,Simply down specific onto.,Resolved
INC-1021,SRV-005,2025-12-02,P4,Database,2025-12-02 13:00:19,2025-12-02 13:53:19,53,Later easy ask again network open according.,Resolved
INC-1356,SRV-005,2025-12-02,P4,Application,2025-12-02 13:12:26,2025-12-02 13:58:26,46,Reveal physical character in rather team.,Resolved
INC-1097,SRV-007,2025-12-02,P2,Network,2025-12-02 15:01:30,2025-12-02 17:29:30,148,Our threat same page.,Resolved
INC-1207,SRV-002,2025-12-02,P2,Application,2025-12-02 16:28:00,2025-12-02 17:35:00,67,Call door population.,Resolved
INC-1040,SRV-001,2025-12-03,P3,Application,2025-12-03 16:55:19,2025-12-03 17:05:19,10,Relationship night born war real chance along.,Resolved
INC-1125,SRV-001,2025-12-03,P3,Application,2025-12-03 22:48:11,2025-12-03 23:58:11,70,Often run bed.,Resolved
INC-1136,SRV-003,2025-12-04,P4,Network,2025-12-04 10:09:47,2025-12-04 10:24:47,15,Wear talk between rate name within.,Resolved
INC-1306,SRV-008,2025-12-04,P4,Application,2025-12-04 19:25:19,2025-12-04 20:19:19,54,Seven bill beautiful issue news mention.,Resolved
INC-1412,SRV-001,2025-12-05,P4,Application,2025-12-05 07:11:33,2025-12-05 08:09:33,58,Enter economic attack.,Resolved
INC-1273,SRV-003,2025-12-05,P1,Infrastructure,2025-12-05 14:07:56,2025-12-05 19:01:56,294,Public the each analysis keep music senior simply.,Resolved
INC-1440,SRV-005,2025-12-05,P2,Application,2025-12-05 15:10:07,2025-12-05 16:17:07,67,Whether listen necessary general.,Resolved
INC-1423,SRV-006,2025-12-05,P3,Application,2025-12-05 17:27:36,2025-12-05 19:26:36,119,Enjoy let difficult.,Resolved
INC-1394,SRV-003,2025-12-05,P3,Application,2025-12-05 18:19:40,2025-12-05 19:23:40,64,Alone people early far.,Resolved
INC-1143,SRV-006,2025-12-06,P3,Application,2025-12-06 14:30:40,2025-12-06 14:53:40,23,Message board mean war analysis situation.,Resolved
INC-1173,SRV-007,2025-12-06,P3,Infrastructure,2025-12-06 15:19:47,2025-12-06 16:27:47,68,Specific study word base.,Resolved
INC-1130,SRV-007,2025-12-08,P3,Application,2025-12-08 07:28:46,2025-12-08 08:57:46,89,Pull public once state wait board.,Resolved
INC-1494,SRV-002,2025-12-09,P3,Infrastructure,2025-12-09 20:44:50,2025-12-09 21:44:50,60,What care material morning any very stuff lot.,Resolved
INC-1254,SRV-002,2025-12-10,P4,Application,2025-12-10 07:47:34,2025-12-10 08:19:34,32,Responsibility add front far purpose.,Resolved
INC-1271,SRV-001,2025-12-10,P4,Application,2025-12-10 08:00:19,2025-12-10 08:58:19,58,Choice country themselves she allow produce.,Resolved
INC-1485,SRV-004,2025-12-10,P3,Database,2025-12-10 08:10:18,2025-12-10 10:03:18,113,Soon large task language budget market.,Resolved
INC-1241,SRV-006,2025-12-10,P3,Application,2025-12-10 13:39:28,2025-12-10 13:57:28,18,Garden great sign return poor really particular.,Resolved
INC-1072,SRV-004,2025-12-12,P4,Application,2025-12-12 13:59:51,2025-12-12 14:08:51,9,Short cold parent security boy.,Resolved
INC-1228,SRV-003,2025-12-13,P1,Application,2025-12-13 11:03:56,2025-12-13 13:13:56,130,These market bed hotel lead drive on.,Resolved
INC-1024,SRV-003,2025-12-13,P1,Network,2025-12-13 11:58:07,2025-12-13 16:03:07,245,Pull worker better.,Resolved
INC-1190,SRV-007,2025-12-14,P3,Network,2025-12-14 12:58:23,2025-12-14 13:13:23,15,Past town affect democratic change vote participant.,Resolved
INC-1184,SRV-003,2025-12-14,P4,Infrastructure,2025-12-14 13:29:32,2025-12-14 13:48:32,19,Happy water worker left example.,Resolved
INC-1398,SRV-003,2025-12-15,P3,Application,2025-12-15 13:26:01,2025-12-15 14:08:01,42,Group once do city easy drop move.,Resolved
INC-1278,SRV-005,2025-12-15,P4,Infrastructure,2025-12-15 14:24:55,2025-12-15 14:51:55,27,Support feeling remain south trip.,Resolved
INC-1131,SRV-004,2025-12-15,P2,Application,2025-12-15 14:47:58,2025-12-15 16:24:58,97,People wall foreign.,Resolved
INC-1216,SRV-006,2025-12-17,P3,Network,2025-12-17 10:18:55,2025-12-17 11:32:55,74,Improve important offer by first avoid letter.,Resolved
INC-1447,SRV-004,2025-12-19,P3,Application,2025-12-19 10:40:39,2025-12-19 11:25:39,45,From everybody foot everybody.,Resolved
INC-1078,SRV-003,2025-12-19,P3,Infrastructure,2025-12-19 14:32:24,2025-12-19 15:18:24,46,Itself room environmental system store beautiful think.,Resolved
INC-1407,SRV-001,2025-12-21,P3,Application,2025-12-21 13:23:59,2025-12-21 14:01:59,38,Company why really up skin development.,Resolved
INC-1335,SRV-005,2025-12-21,P3,Application,2025-12-21 13:34:34,2025-12-21 13:46:34,12,Bar air set factor.,Resolved
INC-1333,SRV-003,2025-12-22,P3,Application,2025-12-22 11:09:40,2025-12-22 12:37:40,88,Cell fire late approach grow.,Resolved
INC-1314,SRV-001,2025-12-22,P1,Application,2025-12-22 19:55:11,2025-12-23 01:50:11,355,Site for exactly skill half usually customer.,Resolved
INC-1012,SRV-004,2025-12-23,P3,Infrastructure,2025-12-23 14:24:03,2025-12-23 16:21:03,117,Sense technology check civil.,Resolved
INC-1378,SRV-001,2025-12-23,P3,Application,2025-12-23 22:26:17,2025-12-24 00:02:17,96,Run national somebody character usually.,Resolved
INC-1287,SRV-008,2025-12-25,P3,Application,2025-12-25 16:11:37,2025-12-25 18:03:37,112,Pressure range either start whom politics make.,Resolved
INC-1016,SRV-007,2025-12-26,P3,Database,2025-12-26 09:34:02,2025-12-26 10:35:02,61,Medical blood personal success.,Resolved
INC-1185,SRV-007,2025-12-27,P3,Database,2025-12-27 16:46:48,2025-12-27 18:38:48,112,Industry class current painting their appear lose.,Resolved
INC-1017,SRV-002,2025-12-29,P3,Infrastructure,2025-12-29 15:08:39,2025-12-29 17:08:39,120,Current hear claim well two truth out major.,Resolved
INC-1495,SRV-008,2025-12-29,P4,Application,2025-12-29 16:27:21,2025-12-29 17:25:21,58,Reality community spring billion.,Resolved
INC-1050,SRV-002,2025-12-30,P4,Database,2025-12-30 15:08:30,2025-12-30 15:36:30,28,History office effort remember.,Resolved
INC-1187,SRV-005,2025-12-31,P3,Application,2025-12-31 13:43:39,2025-12-31 15:38:39,115,Store begin treat stage.,Resolved
INC-1217,SRV-002,2026-01-01,P3,Application,2026-01-01 13:42:41,2026-01-01 15:03:41,81,Campaign stop necessary onto should can.,Resolved
INC-1430,SRV-002,2026-01-02,P2,Application,2026-01-02 09:27:41,2026-01-02 13:13:41,226,True actually red onto site both change.,Resolved
INC-1240,SRV-008,2026-01-02,P4,Infrastructure,2026-01-02 10:29:40,2026-01-02 11:10:40,41,Night your long heavy what.,Resolved
INC-1051,SRV-005,2026-01-02,P4,Application,2026-01-02 12:28:31,2026-01-02 13:24:31,56,Rather vote say culture issue we TV.,Resolved
INC-1425,SRV-002,2026-01-03,P3,Infrastructure,2026-01-03 19:30:11,2026-01-03 20:15:11,45,Whole reach view of dog federal.,Resolved
INC-1289,SRV-006,2026-01-04,P3,Network,2026-01-04 11:11:57,2026-01-04 12:02:57,51,Stuff avoid stand.,Resolved
INC-1174,SRV-008,2026-01-04,P4,Network,2026-01-04 15:12:22,2026-01-04 15:41:22,29,Particular hair truth hold simple quickly appear.,Resolved
INC-1180,SRV-001,2026-01-05,P4,Application,2026-01-05 16:19:49,2026-01-05 17:10:49,51,Product then peace.,Resolved
INC-1020,SRV-006,2026-01-05,P4,Network,2026-01-05 19:34:34,2026-01-05 20:06:34,32,Institution deep much role cut find yet practice.,Resolved
INC-1262,SRV-008,2026-01-06,P4,Infrastructure,2026-01-06 01:36:49,2026-01-06 02:30:49,54,Back nor article natural measure of.,Resolved
INC-1083,SRV-002,2026-01-07,P4,Infrastructure,2026-01-07 11:00:03,2026-01-07 11:19:03,19,International second former reflect even edge.,Resolved
INC-1247,SRV-006,2026-01-07,P4,Database,2026-01-07 11:51:55,2026-01-07 12:01:55,10,Point appear including response beyond.,Resolved
INC-1235,SRV-002,2026-01-07,P3,Application,2026-01-07 16:27:00,2026-01-07 17:16:00,49,Remember feel staff happy purpose woman on.,Resolved
INC-1162,SRV-003,2026-01-07,P3,Application,2026-01-07 18:58:38,2026-01-07 20:31:38,93,Matter street south author technology.,Resolved
INC-1086,SRV-007,2026-01-08,P4,Database,2026-01-08 17:46:59,2026-01-08 18:26:59,40,Ever window network recently.,Resolved
INC-1284,SRV-005,2026-01-08,P3,Network,2026-01-08 22:52:46,2026-01-09 00:24:46,92,Final growth third letter sort reveal.,Resolved
INC-1364,SRV-003,2026-01-09,P1,Application,2026-01-09 16:11:47,2026-01-09 22:56:47,405,Pattern everyone finally memory data space movie.,Resolved
INC-1026,SRV-002,2026-01-10,P3,Database,2026-01-10 09:05:41,2026-01-10 10:23:41,78,Why unit support.,Resolved
INC-1066,SRV-004,2026-01-10,P3,Application,2026-01-10 13:22:45,2026-01-10 14:56:45,94,Son today major event magazine home protect.,Resolved
INC-1253,SRV-006,2026-01-11,P3,Database,2026-01-11 18:19:39,2026-01-11 19:54:39,95,Management voice surface life cover both class.,Resolved
INC-1095,SRV-007,2026-01-12,P3,Infrastructure,2026-01-12 08:01:21,2026-01-12 09:58:21,117,Positive training step author coach.,Resolved
INC-1315,SRV-007,2026-01-12,P4,Application,2026-01-12 14:13:54,2026-01-12 14:19:54,6,Race nearly well left.,Resolved
INC-1002,SRV-001,2026-01-12,P2,Application,2026-01-12 16:13:21,2026-01-12 19:46:21,213,Determine operation speak according south recently.,Resolved
INC-1417,SRV-008,2026-01-13,P1,Infrastructure,2026-01-13 14:18:26,2026-01-13 22:10:26,472,Full world throw relate.,Resolved
INC-1395,SRV-007,2026-01-14,P4,Infrastructure,2026-01-14 12:03:25,2026-01-14 12:28:25,25,Article evidence case current this moment piece.,Resolved
INC-1037,SRV-004,2026-01-15,P3,Database,2026-01-15 06:11:05,2026-01-15 06:30:05,19,Evening painting response data.,Resolved
INC-1005,SRV-002,2026-01-15,P3,Application,2026-01-15 13:48:29,2026-01-15 14:43:29,55,Stop peace technology officer relate.,Resolved
INC-1215,SRV-007,2026-01-15,P4,Database,2026-01-15 17:42:19,2026-01-15 18:33:19,51,Partner beat finally yourself.,Resolved
INC-1060,SRV-001,2026-01-18,P4,Database,2026-01-18 12:50:40,2026-01-18 13:08:40,18,Fish sense kind spring throughout interview trade knowledge.,Resolved
INC-1327,SRV-005,2026-01-18,P2,Infrastructure,2026-01-18 17:27:13,2026-01-18 21:12:13,225,When discussion if continue policy it.,Resolved
INC-1279,SRV-002,2026-01-19,P2,Infrastructure,2026-01-19 12:22:01,2026-01-19 16:00:01,218,Whose newspaper care drug data position.,Resolved
INC-1320,SRV-006,2026-01-19,P3,Application,2026-01-19 14:32:36,2026-01-19 14:57:36,25,Whom former someone black better develop.,Resolved
INC-1402,SRV-008,2026-01-19,P1,Database,2026-01-19 14:58:18,2026-01-19 16:58:18,120,Student special wife my compare.,Resolved
INC-1488,SRV-005,2026-01-19,P2,Database,2026-01-19 20:58:10,2026-01-19 22:00:10,62,Pressure lay future stay staff.,Resolved
INC-1431,SRV-006,2026-01-21,P3,Network,2026-01-21 05:38:17,2026-01-21 06:22:17,44,Old who beyond black single size test they.,Resolved
INC-1023,SRV-003,2026-01-22,P3,Application,2026-01-22 08:09:26,2026-01-22 09:58:26,109,Line six space couple best issue interest.,Resolved
INC-1442,SRV-008,2026-01-23,P3,Application,2026-01-23 05:15:54,2026-01-23 05:50:54,35,Tax positive question especially important.,Resolved
INC-1250,SRV-006,2026-01-23,P2,Network,2026-01-23 08:38:38,2026-01-23 09:32:38,54,Movement rich view tree company.,Resolved
INC-1409,SRV-004,2026-01-23,P3,Application,2026-01-23 16:24:26,2026-01-23 17:57:26,93,Surface side nothing consider fish speak.,Resolved
INC-1108,SRV-006,2026-01-26,P3,Network,2026-01-26 15:22:39,2026-01-26 16:54:39,92,Tend land machine forward several help usually.,Resolved
INC-1030,SRV-004,2026-01-27,P3,Application,2026-01-27 11:01:47,2026-01-27 11:11:47,10,Me system church whether bag control organization.,Resolved
INC-1264,SRV-008,2026-01-27,P3,Database,2026-01-27 12:55:49,2026-01-27 14:15:49,80,Before member speak law message lead around.,Resolved
INC-1139,SRV-003,2026-01-28,P1,Application,2026-01-28 09:38:11,2026-01-28 12:46:11,188,Spend do similar small other.,Resolved
INC-1405,SRV-005,2026-01-28,P3,Application,2026-01-28 16:41:37,2026-01-28 17:54:37,73,Similar suffer team whether.,Resolved
INC-1142,SRV-007,2026-01-29,P2,Application,2026-01-29 07:17:25,2026-01-29 09:52:25,155,Administration enter camera inside box as.,Resolved
INC-1408,SRV-007,2026-01-29,P3,Application,2026-01-29 14:01:47,2026-01-29 14:36:47,35,Her safe family concern.,Resolved
INC-1401,SRV-004,2026-01-30,P2,Application,2026-01-30 11:55:43,2026-01-30 13:50:43,115,Region goal nothing.,Resolved
INC-1111,SRV-008,2026-01-30,P3,Application,2026-01-30 13:41:49,2026-01-30 15:36:49,115,Thank them key moment lead reveal.,Resolved
INC-1276,SRV-002,2026-01-30,P3,Application,2026-01-30 14:11:14,2026-01-30 15:07:14,56,Personal interview many win.,Resolved
INC-1068,SRV-006,2026-01-30,P3,Database,2026-01-30 15:32:25,2026-01-30 15:56:25,24,Production base investment term consider employee force.,Resolved
INC-1177,SRV-005,2026-02-01,P3,Infrastructure,2026-02-01 19:47:10,2026-02-01 20:26:10,39,Finally heavy social spend.,Resolved
INC-1318,SRV-006,2026-02-02,P3,Application,2026-02-02 15:30:50,2026-02-02 16:20:50,50,Old move type thank industry already why.,Resolved
INC-1403,SRV-004,2026-02-03,P3,Infrastructure,2026-02-03 14:48:13,2026-02-03 16:28:13,100,After long forward pass southern.,Resolved
INC-1313,SRV-006,2026-02-04,P2,Database,2026-02-04 17:37:11,2026-02-04 20:31:11,174,Look concern huge five same.,Resolved
INC-1221,SRV-007,2026-02-05,P4,Network,2026-02-05 06:11:12,2026-02-05 07:03:12,52,Successful nor stay agreement animal political.,Resolved
INC-1359,SRV-008,2026-02-05,P1,Infrastructure,2026-02-05 10:58:41,2026-02-05 13:33:41,155,Single real summer probably feeling.,Resolved
INC-1132,SRV-002,2026-02-06,P2,Application,2026-02-06 09:10:41,2026-02-06 11:24:41,134,Positive play less red power.,Resolved
INC-1470,SRV-008,2026-02-06,P3,Application,2026-02-06 12:07:29,2026-02-06 14:01:29,114,Sing story win group important.,Resolved
INC-1232,SRV-007,2026-02-07,P3,Application,2026-02-07 14:55:05,2026-02-07 16:35:05,100,Campaign benefit health would.,Resolved
INC-1183,SRV-005,2026-02-07,P4,Infrastructure,2026-02-07 15:30:42,2026-02-07 15:56:42,26,Sell six doctor dream whole.,Resolved
INC-1410,SRV-008,2026-02-07,P3,Database,2026-02-07 16:21:07,2026-02-07 17:53:07,92,Policy bit many former back.,Resolved
INC-1234,SRV-006,2026-02-08,P3,Network,2026-02-08 22:39:32,2026-02-09 00:37:32,118,Class wrong school federal from stock.,Resolved
INC-1090,SRV-003,2026-02-10,P2,Infrastructure,2026-02-10 14:09:36,2026-02-10 14:55:36,46,Simply herself training father open.,Resolved
INC-1433,SRV-007,2026-02-10,P3,Network,2026-02-10 16:43:22,2026-02-10 18:12:22,89,Race I how these real any little environmental.,Resolved
INC-1469,SRV-006,2026-02-11,P3,Application,2026-02-11 11:31:45,2026-02-11 12:59:45,88,Red industry together memory pay executive size marriage.,Resolved
INC-1043,SRV-001,2026-02-11,P3,Infrastructure,2026-02-11 12:03:04,2026-02-11 12:20:04,17,Understand door class son.,Resolved
INC-1052,SRV-005,2026-02-12,P3,Database,2026-02-12 11:00:45,2026-02-12 11:23:45,23,Professional by tonight medical project for.,Resolved
INC-1092,SRV-001,2026-02-12,P4,Database,2026-02-12 11:57:21,2026-02-12 12:50:21,53,Enough ball dream necessary choose.,Resolved
INC-1317,SRV-002,2026-02-15,P3,Infrastructure,2026-02-15 12:25:11,2026-02-15 12:55:11,30,Drug probably resource smile available.,Resolved
INC-1198,SRV-002,2026-02-15,P3,Database,2026-02-15 14:50:17,2026-02-15 16:10:17,80,Specific as simply leader.,Resolved
INC-1038,SRV-002,2026-02-16,P4,Network,2026-02-16 08:55:34,2026-02-16 09:34:34,39,Measure economy traditional anything plant.,Resolved
INC-1455,SRV-001,2026-02-16,P2,Application,2026-02-16 10:22:22,2026-02-16 13:37:22,195,Oil per line create build quite morning including.,Resolved
INC-1460,SRV-004,2026-02-16,P3,Application,2026-02-16 21:19:54,2026-02-16 22:13:54,54,Idea whole himself also current health.,Resolved
INC-1087,SRV-008,2026-02-17,P3,Application,2026-02-17 15:10:33,2026-02-17 16:56:33,106,Bill activity expect long future whole education.,Resolved
INC-1000,SRV-004,2026-02-18,P3,Application,2026-02-18 15:01:23,2026-02-18 16:45:23,104,Agent every development say.,Resolved
INC-1138,SRV-005,2026-02-18,P3,Application,2026-02-18 17:44:21,2026-02-18 18:57:21,73,Wife anything four writer skin day stop never.,Resolved
INC-1223,SRV-006,2026-02-19,P3,Infrastructure,2026-02-19 07:23:34,2026-02-19 08:45:34,82,Lot source rate father authority.,Resolved
INC-1277,SRV-001,2026-02-19,P3,Application,2026-02-19 11:33:25,2026-02-19 12:43:25,70,Skill five indicate chance heavy senior.,Resolved
INC-1297,SRV-004,2026-02-20,P3,Database,2026-02-20 15:20:16,2026-02-20 15:33:16,13,Not teach believe month amount deep.,Resolved
INC-1105,SRV-007,2026-02-21,P3,Application,2026-02-21 15:36:30,2026-02-21 17:17:30,101,Marriage respond meeting event.,Resolved
INC-1189,SRV-004,2026-02-22,P3,Application,2026-02-22 07:35:21,2026-02-22 09:06:21,91,Social case expert stop receive catch.,Resolved
INC-1499,SRV-003,2026-02-22,P3,Database,2026-02-22 08:56:39,2026-02-22 09:41:39,45,Mean reason follow break.,Resolved
INC-1486,SRV-003,2026-02-23,P3,Application,2026-02-23 11:22:40,2026-02-23 13:02:40,100,Bill include news.,Resolved
INC-1168,SRV-007,2026-02-24,P1,Application,2026-02-24 13:01:12,2026-02-24 17:12:12,251,Concern significant management senior.,Resolved
INC-1496,SRV-008,2026-02-25,P3,Infrastructure,2026-02-25 09:35:50,2026-02-25 11:12:50,97,Paper focus thing industry participant realize eat huge.,Resolved
INC-1103,SRV-003,2026-02-25,P4,Application,2026-02-25 10:16:20,2026-02-25 11:08:20,52,Left approach million performance material kind appear.,Resolved
INC-1482,SRV-004,2026-02-26,P2,Application,2026-02-26 07:27:52,2026-02-26 08:05:52,38,Loss professional political chance step.,Resolved
INC-1204,SRV-004,2026-02-26,P2,Database,2026-02-26 08:37:49,2026-02-26 09:18:49,41,Fill owner international ready goal.,Resolved
INC-1383,SRV-007,2026-02-27,P4,Network,2026-02-27 11:58:29,2026-02-27 12:45:29,47,Door end fire song.,Resolved
INC-1261,SRV-008,2026-02-27,P2,Database,2026-02-27 13:34:31,2026-02-27 14:53:31,79,Seven quite other skin moment.,Resolved
INC-1036,SRV-004,2026-02-27,P2,Application,2026-02-27 14:55:51,2026-02-27 17:19:51,144,Voice care break blood.,Resolved
INC-1421,SRV-001,2026-02-27,P4,Network,2026-02-27 21:52:32,2026-02-27 22:21:32,29,Outside current agent color factor bank such final.,Resolved
INC-1256,SRV-003,2026-03-01,P2,Application,2026-03-01 19:31:00,2026-03-01 21:16:00,105,Continue cell food easy.,Resolved
INC-1178,SRV-004,2026-03-02,P2,Application,2026-03-02 12:22:15,2026-03-02 15:45:15,203,Behavior provide meet adult final week game.,Resolved
INC-1230,SRV-004,2026-03-03,P3,Application,2026-03-03 11:24:46,2026-03-03 13:20:46,116,Experience account blue care enough hand idea.,Resolved
INC-1129,SRV-004,2026-03-03,P3,Infrastructure,2026-03-03 11:48:17,2026-03-03 12:46:17,58,Whose source hand so add Mr.,Resolved
INC-1001,SRV-002,2026-03-04,P4,Application,2026-03-04 13:47:46,2026-03-04 13:54:46,7,Beautiful instead ahead despite measure ago current.,Resolved
INC-1031,SRV-002,2026-03-04,P2,Database,2026-03-04 21:40:13,2026-03-04 23:34:13,114,Identify walk now often always.,Resolved
INC-1427,SRV-007,2026-03-05,P3,Database,2026-03-05 16:13:58,2026-03-05 17:01:58,48,Challenge we last we cold deep cover amount.,Resolved
INC-1013,SRV-001,2026-03-06,P2,Database,2026-03-06 06:03:40,2026-03-06 08:15:40,132,Others his other life edge network.,Resolved
INC-1449,SRV-008,2026-03-06,P3,Database,2026-03-06 09:49:12,2026-03-06 10:25:12,36,Return pretty young else.,Resolved
INC-1353,SRV-004,2026-03-06,P3,Application,2026-03-06 13:03:54,2026-03-06 13:19:54,16,Act receive stage write institution car.,Resolved
INC-1212,SRV-003,2026-03-06,P3,Infrastructure,2026-03-06 17:42:28,2026-03-06 18:52:28,70,Property remember nearly face feel church.,Resolved
INC-1065,SRV-008,2026-03-12,P4,Application,2026-03-12 19:24:38,2026-03-12 20:21:38,57,Task she herself.,Resolved
INC-1293,SRV-003,2026-03-13,P3,Database,2026-03-13 17:51:04,2026-03-13 18:19:04,28,South travel blood benefit chance court.,Resolved
INC-1384,SRV-006,2026-03-14,P3,Network,2026-03-14 10:08:09,2026-03-14 11:26:09,78,Fish evening avoid dark sister once.,Resolved
INC-1319,SRV-006,2026-03-14,P3,Database,2026-03-14 13:20:19,2026-03-14 13:46:19,26,Order trial body eat professor coach partner.,Resolved
INC-1291,SRV-006,2026-03-16,P3,Application,2026-03-16 12:02:53,2026-03-16 13:07:53,65,Across media health pay.,Resolved
INC-1022,SRV-005,2026-03-16,P2,Database,2026-03-16 14:58:20,2026-03-16 17:37:20,159,Arrive attack all form method everything magazine much.,Resolved
INC-1219,SRV-001,2026-03-17,P4,Application,2026-03-17 14:49:16,2026-03-17 15:36:16,47,Generation wait thus suffer economy.,Resolved
INC-1316,SRV-005,2026-03-17,P3,Application,2026-03-17 16:40:34,2026-03-17 18:33:34,113,Just fact realize standard somebody.,Resolved
INC-1213,SRV-007,2026-03-17,P2,Network,2026-03-17 16:53:49,2026-03-17 20:32:49,219,Soldier meeting building cut.,Resolved
INC-1074,SRV-007,2026-03-19,P3,Application,2026-03-19 03:19:12,2026-03-19 04:58:12,99,Away real physical big significant.,Resolved
